{
  "id": "c3bf52bc",
  "title": "Vokabelliste 1.4",
  "language": "en-GB",
  "schoolYear": 2026,
  "grade": 6,
  "groups": [14, 14, 13],
  "words": [
    ["(das) Buchstabieren, (die) Rechtschreibung", "spelling"],
    ["(der) Fahrplan", "timetable"],
    ["(das) Handy", "mobile (phone)"],
    ["(die) Reise, (die) Fahrt", "journey"],
    ["nehmen, bringen, dauern", "to take, took"],
    ["umsteigen", "to change lines"],
    ["(der) Bahnsteig, (die) Plattform", "platform"],
    ["in Richtung", "towards"],
    ["(der) Meter", "metre"],
    ["folgen, verfolgen", "to follow"],
    ["hier: die Wegbeschreibungen", "directions"],
    ["geradeaus", "straight on"],
    ["abbiegen", "to turn"],
    ["auf", "onto"],
    ["vorbei, vorüber", "past"],
    ["überqueren", "to cross"],
    ["den Weg beschreiben", "to give directions"],
    ["geben", "to give, gave"],
    ["teuer", "expensive"],
    ["weniger", "less"],
    ["(die) Blume", "flower"],
    ["(die) Unterhaltung", "entertainment"],
    ["(die/der) Musiker*in", "musician"],
    ["(um ...) herum", "round"],
    ["(die) Ecke", "corner"],
    ["(der) Eingang, (der) Eintritt", "entrance"],
    ["(die) Gegenwart", "present"],
    ["(die) Kombination, (die) Mischung", "combination"],
    ["(die) U-Bahn", "underground"],
    ["(das) Glas", "glass"],
    ["unten, unter", "below"],
    ["(die) Höhe", "height"],
    ["(die/der) Besucher*in", "visitor"],
    ["(die) Möglichkeit", "possibility"],
    ["(das) Konzert", "concert"],
    ["ganz, gesamt", "whole"],
    ["(der) Tagesausflug", "day out"],
    ["(das) Thema", "theme"],
    ["gratis", "for free"],
    ["eingeben", "to enter"],
    ["(der) Entwurf, (die) Skizze", "draft"]
  ]
}
