{
  "id": "b5ae5446",
  "title": "Vokabelliste 1.3",
  "language": "en-GB",
  "schoolYear": 2026,
  "grade": 6,
  "groups": [16, 16, 16],
  "words": [
    ["(das) Geräusch, (der) Klang", "sound"],
    ["gehören zu, passen", "to go with"],
    ["groß (hochgewachsen)", "tall"],
    ["(das) Europa", "Europe"],
    ["beliebt", "popular"],
    ["(die) Attraktion", "attraction"],
    ["(das) Vereinigte Königreich", "the UK (= United Kingdom)"],
    ["(das) obere Ende, (die) Spitze", "top"],
    ["bis", "until"],
    ["(das) Rad", "wheel"],
    ["(der) Palast", "palace"],
    ["britisch", "British"],
    ["(der) König", "king"],
    ["(die) Königin", "queen"],
    ["(das) Herz", "heart"],
    ["obwohl", "although"],
    ["königlich", "royal"],
    ["(die) Glocke", "bell"],
    ["(der) Turm", "tower"],
    ["(das) Parlament", "parliament"],
    ["(der) Fluss", "river"],
    ["(die) Stufe", "stair"],
    ["kommen, gelangen", "to get, got"],
    ["hässlich", "ugly"],
    ["(das) Gebäude", "building"],
    ["so (clever) wie (Frau Michalski)", "as (smart) as (Ms Michalski)"],
    ["(der) Eintritt", "entry"],
    ["frei, kostenlos", "free"],
    ["entdecken", "to discover"],
    ["(die) Erde", "earth"],
    ["riesig", "huge"],
    ["(die) Ausstellung", "exhibition"],
    ["beweglich", "moving"],
    ["(das) Modell", "model"],
    ["groß (umfangreich)", "large"],
    ["jemals", "ever"],
    ["existieren", "to exist"],
    ["(die) Öffentlichkeit", "the public"],
    ["(die) Art, (die) Spezies", "species"],
    ["(die/der) Erwachsene", "adult"],
    ["(die) Brücke", "bridge"],
    ["besser", "better"],
    ["am besten", "the best"],
    ["schlechter, schlimmer", "worse"],
    ["der/die/das schlechteste/schlimmste", "the worst"],
    ["(der) Vergleich", "comparison"],
    ["jung", "young"],
    ["aufpassen, achten auf", "to pay attention to"]
  ]
}
