{
  "id": "f1e88eb8",
  "title": "Vokabelliste 1.2",
  "language": "en-GB",
  "schoolYear": 2026,
  "grade": 6,
  "groups": [15, 14, 14],
  "words": [
    ["tausend", "thousand"],
    ["(die/der) Römer*in, römisch", "Roman"],
    ["schwierig, schwer", "difficult"],
    ["hart, schwierig", "hard"],
    ["vergleichen", "to compare"],
    ["(der) Flughafen", "airport"],
    ["um, herum, umher", "around"],
    ["(viel) Spaß haben", "to have (a lot of) fun"],
    ["haben", "to have, had"],
    ["auch", "as well"],
    ["können", "to can, could"],
    ["(das) Zeltlager", "camp"],
    ["kennenlernen, treffen", "to meet, met"],
    ["entlang", "along"],
    ["posten, bekannt geben", "to post"],
    ["ungefähr", "about"],
    ["(die) Meile", "mile"],
    ["(der) Hügel", "hill"],
    ["einige, wenige", "a few"],
    ["durch", "through"],
    ["schmecken", "to taste"],
    ["wandern gehen", "to go hiking"],
    ["(der) Tagebucheintrag", "diary entry"],
    ["schrecklich, gemein", "horrible"],
    ["anschließend, später", "afterwards"],
    ["sehr", "very much"],
    ["während", "during"],
    ["bewegt, ereignisreich", "busy"],
    ["sonderbar, merkwürdig, komisch", "strange"],
    ["unglücklicherweise", "unfortunately"],
    ["(das) Adjektiv", "adjective"],
    ["wirklich, echt", "real"],
    ["organisieren", "to organize (= organise)"],
    ["vorsichtig", "careful"],
    ["besonders, vor allem", "especially"],
    ["(der) Tipp", "tip"],
    ["höflich", "polite"],
    ["respektieren", "to respect"],
    ["(die) Kultur", "culture"],
    ["(die) Meinung, (die) Ansicht", "opinion"],
    ["empfehlen", "to recommend"],
    ["veröffentlichen, herausgeben", "to publish"],
    ["kommentieren", "to comment"]
  ]
}
